{
  "external_id": "call_9f2a-1",
  "boss_account_id": "acct_01H8XYZ",
  "ucaas_tenant_id": "tnt_acme",
  "tech_prefix": "1001",
  "call_id": "9f2a",
  "direction": "outbound",
  "from": "+15551234567",
  "to": "+14155550100",
  "start_time": "2026-01-15T10:00:00Z",
  "answer_time": "2026-01-15T10:00:04Z",
  "end_time": "2026-01-15T10:03:04Z",
  "billable_seconds": 180,
  "disposition": "answered",
  "trunk_or_did": "carrier-one",
  "attestation_level": "A",
  "inbound_verstat": null,
  "usage_sequence": 42,
  "mediation_ruleset_version": "2026.01.0"
}
